tower_type,bullet_speed,bullet_damage,bullet_damage_2,bullet_damage_3,cooldown,cooldown_2,cooldown_3,range_radius,range_radius_2,range_radius_3,Base Cost ,upgrade_cost_level 2,upgrade_cost_level 3,description,type,label,image_path
Stove_Cannon,250,4.0,5.0,7.0,1.5,1.3,1.0,90,100,110,20,50,70,Tungku Rempah yang dimodifikasi menjadi senjata pertahanan dapur. Spice Cannon menembakkan bola api berbumbu kuat yang dirancang untuk menghentikan musuh ber-HP besar sejak awal jalur,Single Target Damage,High Damage,res://asset/Stove_Cannon.png
Chilli_Launcher,400,1.5,1.7,2.0,0.3,0.25,0.2,100,110,120,30,70,90,Garlic Barrier yang mengeluarkan aroma menyengat. tidak menyerang secara langsung. namun menciptakan zona yang membuat musuh melambat saat melintasinya,Rapid Fire / Pressure Damage, Burn Spray,res://asset/Chilli_Launcher.png
Garlic_Barrier,0,0,0,0,5.0,4.5,3.5,120,140,160,35,80,100,Tungku Rempah yang dimodifikasi menjadi senjata pertahanan dapur. Spice Cannon menembakkan bola api berbumbu kuat yang dirancang untuk menghentikan musuh berHP besar sejak awal jalur,Area Control - Support,Area Slow,res://asset/Garlic_Barrier.png
Pepper_Grinder,250,5.0,6.0,8.0,1.5,1.3,1.0,75,85,105,45,90,130,Penggiling lada besar yang terus berputar dan menembakkan lada ke arah musuh. Tower ini berfokus pada mengganggu konsentrasi dan ritme serangan musuh,Crowd Control / Debuff,Blind Effect,res://asset/Pepper_Grinder.png
Ice_Chiller,250,4.0,5.0,7.0,3.5,3.0,2.5,180,200,220,50,100,150,Pendingin dapur yang memanfaatkan es dan udara dingin untuk menghentikan laju musuh. Cocok untuk mengendalikan gelombang cepat dan memberi jeda bagi pertahanan,Crowd Control / Freeze,Freeze Blast,res://asset/Ice_Chiller.png
